{
  "emi_inr": 2528.27,
  "totals": {
    "total_paid_inr": 130000,
    "total_interest_inr": 77454.68,
    "total_prepayments_inr": 80000,
    "payoff_month": 0
  },
  "first_row": {
    "month": 1,
    "opening_inr": 400000,
    "interest_inr": 2166.67,
    "principal_inr": 361.6,
    "prepayment_inr": 40000,
    "closing_inr": 359638.4,
    "payment_inr": 42528.27,
    "emi_inr": 2528.27,
    "cash_balance_inr": 47471.73,
    "events": [
      "k401_tranche1:loan:gross=40000,penalty=4000,applied=40000"
    ]
  },
  "row_12": {
    "month": 12,
    "opening_inr": 353692.63,
    "interest_inr": 1915.84,
    "principal_inr": 612.43,
    "prepayment_inr": 40000,
    "closing_inr": 313080.2,
    "payment_inr": 42528.27,
    "emi_inr": 2528.27,
    "cash_balance_inr": 19660.76,
    "events": [
      "k401_tranche2:loan:gross=40000,penalty=4000,applied=40000"
    ]
  },
  "last_row": {
    "month": 43,
    "opening_inr": 345582.77,
    "interest_inr": 0,
    "principal_inr": 0,
    "prepayment_inr": 0,
    "closing_inr": 347454.68,
    "payment_inr": 0,
    "emi_inr": 2528.27,
    "cash_balance_inr": 0,
    "events": [
      "payment_shortfall"
    ]
  },
  "row_count": 43
}
